{
    "id": "http://LRS/SelectionModel",
    "type": "object",
    "$schema": "http://json-schema.org/draft-03/schema",
    "required": [
        "id",
        "selectionModelCategory",
        "name",
        "version",
        "description",
        "factors",
        "selectionThreshold",
        "allocationPercentage",
        "status",
        "scope",
        "scopeCode",
        "defaultReviewType",
        "defaultReviewTypeCode"
    ],
    "properties": {
        "id": {
            "description": "A unique, unchanging identifier for this selection model.",
            "type": "string"
        },
        "selectionModelCategory": {
            "description": "The ID of the Selection Model Category that this model is a version of.",
            "type": "string"
        },
        "name": {
            "description": "A human readable identifier for this selection model.",
            "type": "string"
        },
        "version": {
            "description": "The incremented version for this model (by name).",
            "type": "integer"
        },
        "description": {
            "description": "An optional note field.",
            "type": "string"
        },
        "factors": {
            "description": "A collection of factors that make up this model.",
            "type": "array",
            "items": {
                "$ref": "Factor"
            }
        },
        "selectionThreshold": {
            "description": "A top level multiplier for this selection model.",
            "type": "number"
        },
        "allocationPercentage": {
            "description": "A top level allocation power for this selection model.",
            "type": "number"
        },
        "status": {
            "description": "An enumerated condition. Either 'active', 'draft', or 'archived'.",
            "type": "string"
        },
        "scope": {
            "description": "An enumerated condition. Either 'limited', or 'full'.",
            "type": "string"
        },
        "scopeCode": {
            "description": "Code for an enumerated condition. Either 'L', or 'F'.",
            "type": "string"
        },
        "defaultReviewType": {
            "description": "The review type that this selection model is for by default.",
            "type": "string"
        },
        "defaultReviewTypeCode": {
            "description": "The code of the review type that this selection model is for by default.",
            "type": "string"
        }
    }
}
